FARIDABAD,SHIVMANI HOSPITAL,"5E/PBP,NIT,NEAR NEELAM CHOWK RAILWAY ROAD",121001
MUMBAI,SHIVNEH,"JUNCTION OF CHARNI ROAD & QUEEN,S ROAD",400004
AMRITSAR,SHOOR HOSPITAL,"1/S KHAZANA GATE, INNER CIRCULAR ROAD",143001
THANE,SHRADDHA GENERAL HOSPITAL & ICU & STONE CENTRE,"1ST FLOOR, VISHAL MARRIAGE HALL BUILD HOSPITAL ROAD, NEAR CHOEK,ULHASNAGAR # 3",421003
BELGAUM,SHRADDHA HOSPITAL,ZARI GALLI,591201
AHMEDABAD,SHRADDHA HOSPITAL,"A/15, VIJAY COMPLX, VASNA",380007
BHUJ,SHRADDHA HOSPITAL,"DHANVANTRI HOUSE SEC NO 2, ROAD NO 2, NEAR SUNDARPURI BUS STOP, GANDHIGRAM",370201
KALOL,SHRADDHA HOSPITAL,"VAIBHAV COMPLEX, NEAR G.P.O, GANDHI NAGAR.",382721
AHMEDNAGAR,SHRADDHA HOSPITAL,OPP SAVEDI BUS STAND,414001
MUMBAI,SHRADDHA HOSPITAL,"A1A2B2, RANJAN RITIKA, S.V ROAD, NEXT TO DAHISAR POLICE STN, NEXT TO NEW DDAHISAR POLICE STN",400068
PUNE,SHRADDHA HOSPITAL,"SHREEKRISHNANAGAR NAVECHA ROAD,PIMPLE GURAV",411027
PUNE,SHRADDHA HOSPITAL,"LP CLASSIC BULD PUNE SHOLAPUR ROAD, HADAPSAR",411028
PUNE,SHRADDHA HOSPITAL,"KHODAD ROAD, NARAYAN GAON, TALUK JUNNAR ",410404
PUNE,SHRADDHA HOSPITAL,"SAHADU NANA COMPLEX, GHOTAWADE PHATA KASAR AMBOLI",411042
AURANGABAD,SHRADDHA HOSPITAL & CRITICAL CARE UNIT,"PLOT # 27,MUNJEET NAGAR,AKASHWANI SINGAL SQURE,JALNA ROAD",431001
THANE,SHRADDHA MATERNITY NURSING HOME P) LTD,"BHAYANDER WEST,60 FT ROAD,SHRADDHA COMPLEX, D-WING. THANE,",401101
MUMBAI,SHRADDHA NURSING HOME,"DAHANU-JAWHAR ROAD, BEHIND THIRD PETROL PUMP THANE.",401602
AHMEDABAD,SHRADDHA ORTHOPAEDIC HOSPITAL,"2ND FLOOR SHARAD COMPLEX, OPP BARAI TEMPLE, ESHWANTPUR",382443
MUMBAI,SHRADDHA ORTHOPEDIC & SURGICAL HOSPITAL,"VASANT VIJAY MAHAL,PUSHPA PARK, ROAD-2,MALAD EAST",400097
MUMBAI,SHRADDHA POLY CLINIC & NURSING HOME,"OPP) MIRANI NAGAR, 1ST FLOOR,GANESH GAWDE ROAD, MULUNDW)",400080
GANDHINAGAR,SHRADDHADEEP E.N.T.HOSPITAL,"# 317, GH-4, SECTOR-16",382016
KOLKATA,SHRADHA EYE CARE CENTRE SHRADHA HEALTHCARE PVT LTD),"NO.46,PRAMATHA CHOWDHARY SARANI,NEAR RASAI FACTORY,",700053
JUNAGADH,SHRADHDHA AROGYA MANDIR,"SARDAR BAUG ROAD, JUNAGADH, BEHIND DWARKADHISH MARKET,",362001
HYDERABAD,SHRAVANA NURSING HOME,"5-3-847 Mozamjahi Market,Hyderabad",500001
BIDAR,SHRE HOSPITAL(BIDAR CT SCAN),"# 8/10/57/58/59, BEHIND AKKAMAHADEVI COLLEGE, NEAR MEGUR EYE CARE HOSPITAL",585401
ERODE,SHREE AKATHEESWARAR ANBU HOSPITAL,"498-1, SRT THEATRE OPP ROAD, P.PULIAMPATTI",638495
VALSAD,SHREE ASHARAMKRUPA HOSPITAL,"GARNET SEVEN JEWELS NEAR BHAVSAR PETROL PUMP,SILVASSA ROAD,VAPI",396191
MUMBAI,SHREE ASHIRWAD HOSPITAL,"OPP. MAHAVIR NAGAR, MANPADA ROAD, DOMBIIVILI E)",421201
THANE,SHREE BALAJI HOSPITAL,"B, MIRZA NAGAR BUILDING,BAZARWARD,VIRAR(E)THANA",401305
NASHIK,SHREE BALAJI SUPER SPECIALITY HOSPITAL,"M.G ROAD, DEOLALI GAON NASHIK ROAD OPP.MBASOBA MANDIR DEOLAI GAON",422101
MUMBAI,SHREE BIDADA SARVODAYA TRUST BOMBAY,"286-B, DR.AMBEDKAR ROAD, PAREL,",400012
CHENNAI,SHREE DEVI HOSPITAL,"NO.32,GANDHI ROAD,SRIPERUMBUDUR, KANCHEEPURAM,",602105
BHARATPUR,SHREE DIGAMBER HOSPITAL PVT LTD,"KOTHI GULZAR BAGH, BHARATPUR",321001
THANE,SHREE EYE HOSPITAL,"# 115, SWASTIK PLAZA, POKHARAN ROAD NO 2, THANE WEST.",400602
JALNA,SHREE HOSPITAL,"NEAR GUEST HOUSE STATION ROAD, PARTUR, ",431501
MUMBAI,SHREE HOSPITAL,"2ND FLOOR,RAJKAR BHAVAN,SECTOR-17,THANE",400703
MUMBAI,SHREE HOSPITAL,"NEAR AMBEDKAR GARDEN, KAVAN BLD BEHIND GEETA BHAVAN HOTEL, CHEMBUR EAST",400071
PUNE,SHREE HOSPITAL,"PUNE, MAHARASHTRA-SIDDHARTH MANSION OP AGA KHAN PALACE",411006
PUNE,SHREE HOSPITAL & MATERNITY HOME,"324,DHORE NAGAR,SANGAVI,",411027
HOWRAH,SHREE JAIN HOSPITAL & RESEARCH CENTRE,"#493B/12, G.T. ROAD SOUTH)",711102
DELHI,SHREE JEEVAN HOSPITAL,"67/1 NEW ROHTAK ROAD ,",110005
GHAZIABAD,SHREE KRISHNA HOSPITAL,"NH-2,SECTOR-15,VASUNDHRA,SAHIDABAD,",201012
PUNE,SHREE KRUPA HOSPITAL,"48/2,DYAESH PARK,KRISHNA CHOWK,NEW SANGHVI",411027
PUNE,SHREE LAXMI HOSPITAL,"11/7B,MUNDHWA BY PASS ROAD,NEAR IIT,CHANDANAGAR",411014
RAIGAD,SHREE MHATRE HOSPITAL,"MUMBAI - GOA HIGH WAY,.AT & PO : WADKHAL, TAL- PEN, DIST - RAIGAD ",402107
MUMBAI,SHREE NAGHER SAMAJ SANCHALIT HOSPITAL,"MADHAV NAHG #40, JAGDUSHA NAGAR,GHATKOPAR WEST",400086
BANGALORE,SHREE NANDI HOSPITAL,"# 7,2ND MAIN ROAD,",560018
KOLKATA,SHREE NETRA EYE FOUNDATION,73 CHAKRABERIA ROAD (N),700020
DHULE,SHREE NETRALAYA,"DR.WADGAONKAR SURENDRA PADMAKARRAO,LANE NO.5, VAIDYA COMPLEX,",424001
AHMEDABAD,SHREE NIDHI HOSPITAL,"GOLD COIN COMPLEX,PART A",380015
HYDERABAD,SHREE NURSING HOME,"8-3-978/1, SRINAGAR CLUB CROSS ROAD.",500073
TUMKUR,SHREE NURSING HOME,"# 5, OPP. NEPS, II MAIN, SHANKARAPURAM, BH ROAD",572102
MUMBAI,SHREE NURSING HOME,"19/20-21, BHAVESHWAR BHUVAN,GOKHALE ROADN), OPP PORTUGAL CHURCH, DADAR",400028
AHMEDABAD,SHREE RAJ HOSPITAL,25 MARUTHI CENTRE NEAR GURUKUL,380052
AGRA,SHREE RAM HOSPITAL,"8-9, RAGHUNATH NAGAR, M.G. ROAD",282002
KANPUR,SHREE RAM NURSING HOME PVT LTD,128/817 KBLOCK KIDWAI NAGAR,208011
MUMBAI,SHREE RAMKRISHNA NETRALAYA,"A-WING SHREE BALAJI APTS, NEAR RISK CARE HOSPITAL, MAKHAMALI TALAO, L.B.S. MARG, AGRA ROAD. MULUND WEST",400080
MUMBAI,SHREE RAMNATH EYE CARE,"10,JEEVAN TARA CHSL,AZAD ROAD,OPP FIRE STATION,NEAR MILAN SUBWAY VILE PARLE EAST,MUMBAI",400057
KAUPA,SHREE RAVALNATH MEDICAL SURGICAL & MATERNITY CENTRE,"HAUSA MARIGUDDI ROAD, KAUP",574106
VALSAD,SHREE RENUKA HOSPITAL," MEHTA PARK, GANGADEVI ROAD, NEAR UMBERGAON ROAD STATION, SOLSUMBA TAL - UMBERGAON,",396171
MUMBAI,SHREE SAI HOSPITAL,"#101, ISHA COMPLEX,SECTOR-15,NARUL",400706
MUMBAI,SHREE SAI HOSPITAL,"GOKUL NAGARI-1,NEAR ASHA NAGAR, WESTERN EXPRESS HIGHWAY, KANDIVALIE) ",400101
MUMBAI,SHREE SAI HOSPITAL,"#209/210,SOHAM PLAZA,SOHAM GARDEN,CHITALSAR MANPADA,THANE WEST",400607
RAIGAD,SHREE SAI NURSING HOME & POLYCLINIC,"VISHVAKARMA TOWERS,PLT #4,SECTOR-21,OPP SENT MERY SCHOOL,TATA HOSPITAL ROAD,KHARGHAR",410210
RAIGAD,SHREE SAI RUGNALAYA,"CHINCHPADA,PEN,RAIGAD",402107
PUNE,SHREE SAMARTH HOSPITAL,"227 RASTA PETH,OMKAR APT,KARANDE CHOWK",411011
MUMBAI,SHREE SAMARTH NURSING HOME,"#128,HINDU COLONY,5TH LANE,NAPOO ROAD,DADAR EAST",400014
KUNIGAL,SHREE SAPTHAGIRI HOSPITAL,"B M ROAD, MISSION COMPOUND",572130
COIMBATORE,SHREE SARAVANA NURSING HOME,"356,D.B.ROAD,R.S.PURAM",641002
DINDIGUL,SHREE SATHYA SUBHA HOSPITAL,"#53,NEW AGRAHARAM, PALANI ROAD",624001
AHMEDABAD,SHREE SHAKTI MEDICAL HOSPITAL,"C1/53, ILA SOCIETY, INDIA COLONY ROAD, OPP PODAR HOUSE",380024
DAVANGERE,SHREE SHARADA NURSING HOME,"1ST FLOOR OF GAYATHRI REFRESHMENT,SHIMOGA MAIN ROAD,HARIHAR",577601
MUMBAI,SHREE SIDDHIVINAYAK ORTHOPAEDIC HOSPITAL,"4/9, INDIRA COMPLEX, 60FT ROAD, BHAYANDER WEST,",401101
COIMBATORE,SHREE SIVAA HOSPITAL PVT LTD,"#117/1, ATHIPALAYAM PRIVU, SATHY MAIN ROAD",641006
MUMBAI,SHREE SURGICAL & GENERAL HOSPITAL,"KUBER APPT, AMBADI ROAD, VASAI WEST,THANE",401202
GURGAON,SHREE TIRUPATI BALAJI HOSPITAL,ASHOK VIHAR MAIN PALAM VIHAR ROAD NEAR SECTOR 5 GOL CHAKAR,122001
THANE,SHREE TISAI HOSPITAL,"1ST FLOOR, GANGA TIRTH BLDG, GOVIND COMPLEX, TISGAON NAKA",421306
AHMEDABAD,SHREE VARDHMAN EYE HOSPITAL AND RESEARCH CENTRE,"NEAR JAIN TEMPLE,NEAR KADWAR PATIDAR WADI",380014
BARODA,SHREE VRAJ HOSPITAL,"#7, MANISHA SOCIETY, OLD PADRA ROAD,",390020
MUMBAI,SHREEDEVI HOSPITAL,"AAKASH ARCADE, DR.DEEPAK SHETTY ROAD, KALYAN WEST,",421301
AHMEDABAD,SHREEJI CHILDREN HOSPITAL,"1ST FLOOR, BOPAL ROAD, N.R BOPAL AMBALI # ROADS,SANAND",380058
MUMBAI,SHREEJI EYE CLINIC PHACO SURGERY CENTRE,"NO.104,SARLA SADAN,S.V.ROAD,NEXT TO N.L.SCHOOL,MALAD(WEST),",400064
NAGPUR,SHREEJI HOSPITAL,"RAJLAXMI COMPLEX, DEO NAGAR- SQUARE, KHAMLA ROAD,",440015
BARODA,SHREEJI HOSPITAL AND TRAUMA CENTRE,"ABHISHEK SOE, OPP RAMAKAKA MANDIR,CHHANI.NEAR GEB NATIONAL HIGHWAY NO 8 BARODA",391740
MUMBAI,"SHREEJI KRIPA SURGICAL CENTRE, POLYCLINIC & ICU ","GAURAN DHRUV,BEHIND BHATIA SCHOOL SAI BABA NAGAR RD  BORIVALI W)",400092
AHMEDABAD,SHREEJI MATERNITY AND SURGICAL NURSING HOME,"SIDHI SARJAN OPP KANAK KALA-2, 100FT ROAD, SATELLITE.",380015
AHMEDABAD,SHREEJI ORTHOPAEDIC & ENT HOSPITAL,"F-5, VEEMURTI COMPLEX,GURUKUL ROAD,",380052
BARODA,SHREENATH HOSPITAL,"UTANG,ANANDVAN COMPLEX,NEW IPCL ROAD,SUBHANPUR",390023
HUBLI,SHREEYA HOSPITAL,"C/O IRKAL COMPLEX,OPP.DISTRICT COURT,P.B.ROAD,",580001
PUNE,SHREEYOG HOSPITAL,"CHIMNYA GANPATI CHOWK, RAJGURUNAGAR.",410505
AHMEDABAD,SHREY HOSPITAL P) LTD,"BESIDE AMCO BANK,PANJABI HALL LANE, NAVRANGPURA.",380009
DELHI,SHREYA EYE CENTRE,"D-163, SURAJMAL VIHAR, NEAR YAMUNA SPORTS COMPLEX KARKARDOOMA COURT",110092
BANGALORE,SHREYA HOSPITAL,"# 73, 6TH CROSS, 3RD MAIN,KENGERI SATELLITE TOWN,",560060
SURENDRANAGAR,SHREYANSH HOSPITAL,"MR. APNA BAZAAR, KOTHARIBAL, MANDER ROAD, ",363001
HYDERABAD,SHREYAS HOSPITAL,"SRINIVASA NAGAR COLONY, KAPRA,DR.AS RAO NAGAR",500062
MUMBAI,SHREYAS HOSPITAL,"SAINAGAR,VASAIW)",401202
HUBLI,SHREYAS ORTHOPEDIC & TRAUMA CENTRE,"KADAR PLAZA,COEN ROAD",580020
REWARI,SHRI ASHWINI SAXENA HOSPITAL,"# 343, L MODEL TOWN,BAWAL ROAD",123401
MUMBAI,SHRI BALA HANUMAN MATERNITY & SURGICAL HOAPITAL,"#108-113, LANCELOT, S.V ROAD, BORIVALIW)",400092
DELHI,SHRI BALAJI HOSPITAL P) LTD,"Opp Rohini D.D.A office ,Pitam Pura.",110034
MUMBAI,SHRI BALCHIKISTSALAYA,"# 14, MINILAND TANK ROAD, BHANDUP WEST",400078
BIJAPUR,SHRI BANASHANKARI MATERNITY HOME,"NEAR MEGHRAJA HOTEL, STATION ROAD",586104
SALEM,SHRI BHARATHI NURSING HOME ,"NO-50, SASTRI NAGAR, SANKARI MAIN ROAD, ANNATHANAPATTI, NEAR KONDALAMPATTI BYE PASS",636002
MUMBAI,SHRI CHAITANYA HOSPITAL,"SHIVRAJ, 1ST FLOOR, MANPADA ROAD, ,NEAR SHIVAJI STATUE, DOMBIVALI EAST",421201
BAREILLY,SHRI GANGA CHARAN HOSPITAL,"# 2, RAMPUR GARDEN, BAREILLY, UTTAR PRADESH",243001
BELGAUM,SHRI J.G.CO-OPERATIVE HOSPITAL AND RESEARCH INSTITUTE LTD,"DR.GANGADHAR NAGAR,TQ.GOKAK,GHATAPRABHA.",591321
DELHI,SHRI JIYALAL HOSPITAL & MATERNITY CENTRE,"6, INDER ENCLASE, ROHTAK ROAD, NEAR TEERAGARHI CHOWK",110087
SIKAR,SHRI K.M.MEMORIAL JAIN HEART & GENERAL HOSPTIAL,STATION ROAD,332001
JODHPUR,SHRI RAM HOSPITAL,"8,PAL ROAD,JODHPUR",342001
BAREILLY,SHRI RAM MURTI SMARAK INSTITUTE OF MEDICAL SCIENCES,"RAM MURTI PURAM, 13KM MILESTONE, BAREILY-NAINITAL ROAD,BHOJIPURA.",243001
DELHI,SHRI RAM SINGH HOSPITAL,"B-25-26A, EAST KRISHNA NAGAR, SWARN CINEMA ROAD,  ",110051
CHENNAI,SHRI SAAI KRS HOSPITALS,"29, 7TH AVENUE, ASHOK NAGAR, NEXT TO TITAN SHOWROOM",600083
PUNE,SHRI SAI CHILDREN HOSPITAL,"1ST FLOOR, BABA CONSTRACTIONS BUILDING GULABNAGAR,ABOVE GULAN NAGAR,DHANKAWDI",411045
PUNE,SHRI SAI HOSPITAL,"POONA ALANDI ROAD,DEHU PHATA,ALANDI",412105
SANGLI,SHRI SAI SURGICAL & MATERNITY HOSPITAL,"NEAR CHURCH HEAG POST, ISLAMPUR, ",415409
ARANTHANGI,SHRI SARADHA HOSPITAL,"133,POONGANAGAR MAIN ROAD, ARANTHANGI",614616
SALEM,SHRI SHELLAPHA HOSPITAL,"NO.239,RAJARAMNAGAR,",636007
BHILWARA,SHRI SIDDHI VINAYAK HOSPITAL,"11 - E - 17& 18, Tilak Nagar, Bhilwara, Rajasthan",311001
JALGAON,SHRI SURGICAL & MATERNITY HOME,"M.J COLLEGE ROAD, BEHIND ANANT COLONY",425001
MUMBAI,SHRI UTTAM HOSPITAL,"A4/302,VEDANT COMPLEX,VARTAK NAGAR,THANE WEST",400606
BAGALKOT,SHRI VENKATESWARA HOSPITAL,"Shabadhi Layout, Bagalkot",587101
TUMKUR,SHRI VIJAYA NURSING HOME,"NEAR ARALIKATTE, B.H ROAD, ADJUSCANT TO B.H ROAD",572201
HINGOLI,SHRI VINAYAK HOSPITAL & PATHOLOGY LAB,NARAYAN NAGAR ,431512
BANGALORE,SHRI VINAYAKA NETHRALAYA,"#78, NAGARAJ COMPLEX, HOSUR MAIN ROAD,MADIWALA",560068
CHANDRAPUR,SHRI VYANKATESH HOSPITAL & RESEARCH CENTRE,"CIVIL LINE BEHIND JANATHA SCHOOL, RAMNAGAR",442401
BELGAUM,SHRI.SADGURU EYE HOSPITAL,"FIRST FLOOR, SHAH COMPLEX, OPPOSITE SYNDICATE BANK, K.C ROAD",591201
UTTARKANNADA,"SHRIDEVI MATERNITY & HEALTH CENTER,","Bunder Road ,Honavar UTTARA KANNADA",581334
AHMEDABAD,SHRIJI SURGICAL HOSPITAL,"FIRST FLOOR, GITA COMPLEX, JAWAHARNAGAR,VASNA",380007
MUMBAI,SHRIMATI KAMALADEVI HOSPITAL,"GANESH SOCIETY,SUBASHNAGAR,KALYAN ROAD,BHIWANDI,THANE",421302
TRICHY,SHRIMUTHU NURSING HOME,"95, BIG SOWRASTRA STREET.",620003
PUNE,SHRINIWAS HOSPITAL,"PLOT NO L.C 5A, SECTOR 21, YAMUNANAGAR, NEAR SHIVBHOMI SCHOOL",411044
SIRSI,SHRIPAD HEGDE KADAVE INSTITUTE OF MEDICAL SCIENCES,"MES COLLEGE ROAD, SIRSI",581402
MUMBAI,SHRIPADA MATERNITY AND PAEDIATRIC NURSING HOME,"C WING,REGENCY AVENUE,MURBAD ROAD,KALYAN WEST,THANE",421301
SATARA,SHRIRATNA HOSPITAL(CARDIOTHORACIC CENTRE),"NEAR SUPER MARKET, SHANIWAR PETH, KARAD",415110
DIBRUGARH,SHRISHTI HOSPITAL AND RESEARCH CENTRE PVT.LTD.,"PALTAN BAZAR,",786005
DELHI,SHROFF CHARITY EYE CENTRE,"5027,KEDAR NATH STREET, DARYAGANJ",110002
MUMBAI,SHROFF EYE CLINIC,222 S.V ROAD BANDRAWEST),400050
AHMEDABAD,SHRUTI MATERNITY & SURGICAL NURSING HOME,"D2-D3, MEDKAL COMPLEX, SOLA ROAD, ",380063
JAIPUR,SHUBH HOSPITAL,"A-35, VIDHYUT NAGAR, AJMER ROAD, JAIPUR",302021
SURAT,SHUBHAM CHILDREN HOSPITAL,"SILVER PLAZA COMPLEX, OPP RUPALI CINEMA, RANDER ROAD",395009
DELHI,SHUBHAM HOSPITAL,"DD-15-KALKAJI,",110019
THANE,SHUBHAM HOSPITAL,"SHEETAL NIKETAN TOWER, OPP HUM VIDEO B.P. ROAD,BHAYANDAR EAST,",401105
BARODA,SHUBHECHHA MULTISPECIALITY HOSPITALS PVT LTD,"409-412, SHRINAGAR, AKOTA, VRMI CHAR RASTA",390020
MUMBAI,SHUSHRUSHA HEART CENTRE,"PLOT NO 22A,PHASE III,SECTOR 6,",400706
CHANDRAPUR,SHUSHRUSHA HOSPITAL,"#175,JATPURA GATE,CHANDRAPUR",422401
MUMBAI,SHUSHRUSHA HOSPITAL,"1357/7 & 8, CHALPETH ROAD, NEAR K.G HIGH SCHOOL",401301
BANGALORE,SHUSHRUSHA NURSING HOME,"B.B. ROAD, YELANKHA,",560064
KOLKATA,SHUSRUSHA NURSING HOME PVT.LTD,"P-290,CIT SCHEME 6-M,UPENDRA CH,BANERJEE ROAD,",700054
MUMBAI,SHUSRUT HOSPITAL,"#365, SWASTIK PARK, CHEMBUR",400071
DELHI,SHYAM LAL EYE HOSPITAL,"MALKA GANJ, NEAR HANS RAJ COLLEGE",110007
PATNA,SHYAMAL HOSPITAL PVT LTD,"MAURYA PATH, KHAJPURA.",800014
ERODE,SHYAMALA HOSPITAL,"NO -1, OLD POST OFFICE ROAD, NORTH STREET, NEAR UMA MAHESHWARY HOSPITAL",638401
CHENNAI,SHYAMALA NURSING HOME,"32, CEMETRY ROAD,OLD WASERMENPET",600021
CHENNAI,SIBI HOSPITAL,"#5,MADIPAKKAM KOOT ROAD,MADIPAKKAM",600091
SANGRUR,SIBIA HEALTHCARE PVT LTD,"JIND ROAD,SANGRUR,OPP KISSAN GHEEMILL",148001
GULBARGA,SIDDAGANGA HOSPITAL,"MSK MILL ROAD,VASANTH NAGAR",573201
TANJORE,SIDDARTH CLINIC,"# 10, BANDURAI, SOUTH STREET",612001
MUMBAI,SIDDHANT HOSPITAL & ICU,"WOOLLEN CHAWL ROAD,(S.V.P.ROAD)AMBARNATH,THANE",421501
SALEM,SIDDHARTH MATERNITY CENTRE,"46-A, INDIRA NAGAR, METTUR DAM, BHAVANI MAIN ROAD",636401
EASTGODAVARI,SIDDHARTHA HOSPITAL,"#:34-1-20 ; TEMPLE STREET, NEAT CANARA BANK",575003
RAJAMUNDRY,SIDDHARTHA ORTHOPAEDIC HOSPITAL & POLYCLINIC,"D.NO-29-14-96, LAKSHMIVARAPUPETA",411028
BANGALORE,SIDDHI EYE CARE CENTRE,"# 229, 7TH CROSS, 1ST STAGE, INDIRANAGAR. ",560038
PUNE,SIDDHI HOSPITAL & LAPROSCOPY CENTRE PVT LTD,"PUNE - SATARA ROAD, ABOVE ' HOTEL AKSHAY'",411043
MUMBAI,SIDDHI NURSING HOME,"16/212,ANAND NAGAR VAKOLA,SANTACRUZ EAST",400055
MUMBAI,SIDDHI NURSING HOME,"4, ANAND NAGAR, SAHAR ROAD, ANDHERI E)",400069
AHMEDABAD,SIDDHI VINAYAK HOSPITAL,"JALDHARA WATER PARK ROAD, MANINAGAR.",380008
JALGAON,SIDDHIVINAYAK HOSPITAL JALGAON," NR.EECHADEVI MANDIR, NATIONAL HIGH NO.6",425001
MUMBAI,SIDDIVINAYAK HEALTHCARE PVT LTD,"ISHAAN, 1ST FLOOR, KHED GULLY, PRABHADEVI, DADAR WEST",400025
PATNA,SIDDQUIE NURSING HOME ,"ASHOK RAJPATH, OPP BN COLLEGE",800004
LUDHIANA,SIDHU HOSPITAL PVT LTD,"G.T. ROAD, DORAHA, NEAR RIVER BRIDGE",141421
HYDERABAD,SIGMA HOSPITAL,"APPIIC COLONY IDA JEEDIMETLA,RANGA REDDY.",500055
SECUNDERABAD,SIGMA HOSPITAL,"35, S.D. ROAD,NEAR CLOCK TOWER",500003
HYDERABAD,SIGMA HOSPITALS,"D.NO.16-11-740/3/14,GADDIANNARAM,DILSUKNAGAR",500060
LUDHIANA,SIGMA NEW LIFE HOSPITAL,"3297, GURDEV NAGAR, NEAR AARTI CINEMA, LUDHIANA",141001
COIMBATORE,SILOAM THOMAS EYE HOSPITAL,"# 15, CHINNAMMAL STRET, K.K. PUDUR.",641038
DELHI,SILVER LINE NURSING HOME,"B-1, WEST VINOD NAGAR",110092
MOHALI,SILVER OAKS HOSPITAL,"PHASE-9,",160063
KOLKATA,SILVERLINE EYE HOSPITAL A UNIT OF BISWAS MEDICAL CENTRE),"NO.396,PRINCE ANWAR SHAH ROAD,",700045
VIZAG,SIMHADRI HOSPITAL,"15-12-1, KRISHNA NAGAR, MAHARANI PETA, NEAR COLLECTORATE JN",530002
SHIMLA,SIMLA SANITARIUMS HOSPITAL,"CARTON HOUSE,CHAURA MAIDAN,NEAR HP VIDHAN SABHA",171004
PATIALA,SIMRITA NURSING HOME,"# 68, DALIMA VIHAR, RAJPURA, PATIALA, PUNJAB-",140401
PUNE,SINDHU NURSING HOME,"S.NO 135 136,PLOT NOD 1,2,3, RAHULCOMPLEX,PAUD ROAD,KOTHRUD",411038
SHIMOGA,SINDHU UROLOGY HOSPITAL,"RMR ROAD, DURGIGUDI,BEHIND NANJAPPA HOSPITAL, KUVEMPU ROAD",577202
WARANGAL,SINDHUJA MULTI SPECIALITY NURSING HOME,"NEAR BUS STOP, SHATHUBHUNIPET",506005
SRIKAKULAM,SINDHURA NURSING HOME,"NEAR NEWBRIDGE,DAY & NIGHT JUNCTION",532001
KANCHIPURAM,SINDU HOSPITAL,"# 203,KARMPO ROAD JUNCTION, SELYURAI,",600073
VIJAYAWADA,SINGARI ENT HOSPITAL & RESEARCH CENTRE,"#29-9-54, GOVINDARAJULU NAIDU, STREET,SURYARAOPET",520002
RANCHI,SINGH EYE CLINIC,"RD NO 1,C 259 ASHOK NAGAR",834002
MORADABAD,SINGH HOSPITAL,"B-30, GANDHI NAGAR,MORADABAD,UTTAR PRADESH",244001
HOWRAH,SINGH MEDICARE INSTITUTE PVT LTD,"NO.263/3,G.T.ROAD SOUTH),",711102
BARODA,SINGH NURSING HOME & CHILDREN HOSPITAL,"#55,KISHAN COMPLEX,1ST FLOOR,OPP YASH COMPLEX",390021
DELHI,SINGHAL HOSPITAL,"C-40,STREET NO.9,SADHNAGAR,NAZAFGARH,",110045
DELHI,SINGHAL NURSING HOME,"IX / 3,MAIN ROAD, KAILASH NAGAR",110031
MUMBAI,SINGHI HOSPITAL,"B WING, ASHOKRAJ, S.V. ROAD, GOREGAN W)",400062
KOTAKPURA,SINGLA EYE HOSPITAL & MATERNITY HOME,"FAUJI ROAD,KOTKAPURA",151204
PATIALA,SINGLA HOSPITAL,36 DHILLON MARG,147001
SANGRUR,Singla Surgical Hospital ,MEHAL MUBARIK COLONY,148001 
DELHI,SIR GANGA RAM HOSPITAL,"RAJINDER NAGAR, ",110060
THANE,SIRAJ MEMORIAL HOSPITAL & DIAGNOSTIC CENTRE,"242/4TH  NIZAMPURA,BHIWANDI,",421302
KURNOOL,SIRI NOBLE HOSPITAL,"44-16G 45,SUNKESULA ROAD,NEAR ROJAMMA COLLEGE",518004
LUDHIANA,SIRISH HOSPITAL,"B-XX-1140, KRISHNA NAGAR, NEAR GURDWARA MAI NANDKAUR",141001
FARIDABAD,SIROHI MEDICAL CENTRE P) LTD.,CLINIC PLOT NO.5 SECTOR-3 ,121004
SIRUMUGAI,SIRUMUGAI SRI BALAJI NURSING HOME,"SATHY MAIN ROAD,METTUPALAYAM",641302
BANGALORE,SITA BHATEJA SPECIALITY HOSPITAL,"NO 8 & 9, O'SHAUGHNESSY ROAD, LANGFORD GARDENS, NEAR DIVYASREE CHAMBERS, HOCKEY STADIUM, SHANTI NAGAR",560025
SURAT,SITA HOSPITAL,"J.M DOCTOR HOUSE, BEHIND JK TOWER, BESIDES SUB-JAIL, RING ROAD",395002
MUMBAI,SITLA HOSPITAL,"19-B,SINDHI SOCIETY, NEAR BHAKTI BHAVAN, CHEMBUR",400071
CHENNAI,SIVA E.N.T HOSPITAL,"159 OLD NO.94) LLOYDS ROAD, OPP TO ADMK HEAD OFFICE, ROYAPETTAH,",600014
GUNTUR,SIVA NURSING HOME,"RAJA GARI KOTA, NARASARAO PETA",522601
MADURAI,SIVA POLY CLINIC S.L HOSPITAL,"NO 71, NARIMEDU MAIN ROAD, ",625002
CHENNAI,SIVA SAKTHI NURSING HOME,"# 7, VENKATESWARA LANE, ANNA NEDNMPATHAI, CHOOLAIMEDA, NEAR KODAMBAKKAM (POWER  HOUSE)",600094
CHENNAI,SIVA SUBRAMANIAM NURSING HOME,"# 1/28, VASU DEVAN STREET, KOTTIPAKAM,",600041
SECUNDERABAD,SKM HOSPITAL,"7-A, PANCHSHEEL ENCLAVE, HASHMATPET, SECUNDERABAD",500009
SALEM,SKS HOSPITAL,"Alagapuram, Brindavan Road, Salem",636004
ALAPPUZHA,SMC HOSPITAL (TSUNAMI PROJECT ONLY),MUTHUKLAM SOUTH PO,690506
DELHI,SMH-CURIE CANCER CENTRE,"NO-2 INSTITUTIONAL AREA VIKAS MARG EXT, NEAR POST OFFICE (KRISHNA NAGAR), KARKARDHOMA",110092
MUMBAI,SMRUTI NURSING HOME," MAHESHWAR DARSHAN, S V RD, SANTACRUZ WEST,",400054
TIRUNELVEL,SMS HOSPITAL,"NO.28,SIVAN NORTH CAR STREET,PALAYAMKOTTSI,",627002
NAVSARI,SMT. GULABBEN CHHOTUBHAI PATEL GENERAL HOSPITAL,SARDAR CHOWK,396445
HYDERABAD,SMT.BHAGWAN DEVI HOSPITAL,"21-7-191,CHARKAMAN,NEAR AGRA SWEETS-GULZARHOOZ",500001
MUMBAI,SMT.LAXMIBEN DHARAMSHI KARSAN GALA EYE HOSPITAL,"# 261, SUMAT BHUVAN, MALAVIYA ROAD, ABOVE JAIN STHANAK, VILE PARLE EAST",400057
SILVASSA,SMT.RAMABEN MATERNITY & GENERAL HOSPITAL,"1ST FLOOR, BHUMICA CITY CENTREM.G. ROAD, NEAR JAIN TEMPLE SILVASSA.",396230
MUMBAI,SMT.S.R.MEHTA & SIR K.P.CARDIAC INSTITUTE,"PLOT #96, ROAD # 31, KINGS CIRCLE, NEAR GANDHI MARKET,",400022
HASSAN,SMT.SAVITHRAMMA SRI SHANASAPPA HOSPITAL & RESEARCH CENTRE,"HASSAN ROAD, NEAR MUNCIPAL CIRCLE, ARASIKERE",573103
CHURU,SMT.SHEELA GOYAL MEMORIAL HEART AND GENERAL HOSPITAL,STATION ROAD.,331001
COIMBATORE,SMYL HOSPITAL,"5/431, TEACHERS COLONY, OPP TO CTC BUS DEPOT",641301
NAGPUR,SNEH NURSING HOME,"277-A,KAMLA SMRUTI CENTRAL BAZAR ROAD,RAMDASPETH",440010
AHMEDABAD,SNEH ORTHOPAEDIC  HOSPITAL,"35, 36 BANSIDHAR SOCIETY, NR.ANJALI CROSS ROAD, VASNA",380007
MUMBAI,"SNEHA MATERNITY SURGICAL & GENERAL NURSING HOME,",",OLD NAGARDAS ROAD,CHENNAI COLLEGE ANDHERI EAST,",400069
BANGALORE,SNEHA NURSING HOME,"# 76/1, 11TH CROSS, WEST OF CHORD ROAD MAHALAKSHMI PURAM",560086
MUMBAI,SNEHAL E.N.T.CLINIC,"G-1, SHREE RAGHUVANSHI APT, CHANDAVARKAR ROAD, BORIVLI EAST",400066
INDORE,SNG HOSPITAL,"16/1M SOUTH TUKOGANJ, NEAR SOMESHWAR MANDIV",452001
DELHI,SODHI NURSING HOME & ENT HOSPITAL,"NO.455,BHERA ENCLAVE,",110087
RAIGAD,SOHAM HOSPITAL,"CHINCHPADA, PEN NEAR PANCHAYAT SAMITI",402107
NASHIK,SOHAM HOSPITAL & MEDICAL FOUNDATION PVT LTD,SHARANPUR ROAD,420002
ALWAR,SOLANKI HOSPITAL,"# 10, RAM KUTIR, NEAR ASHOK CIRCLE, ",301001
JAIPUR,SOLOMON HOSPITAL,"MAIN ROAD, SECTOR-9, MALVIYA NAGAR, JAIPUR",302017
GURGAON,SONA DEVI MEMORIAL HOSPITAL & TRAUMA CENTRE,"OPP VATIKA ARCADE,BADSHAHPUR,SOHNA ROAD",133001
MUMBAI,SONA MEDICAL CENTRE,"# 82,CSM ROAD, VAKOLA BRIDGE,SANTACRUZ EAST",400055
PATAN,SONAM HOSPITAL & UROLOGY CENTRE,"NEAR BUS STAND, SIDHPUR, PATAN, GUJARAT-384151 ",384151
JALNA,SONI HOSPTIAL,"NO 8, KARWANAGAR, AZAG MAIDHAN ROAD, OPP DR FRAZER HIGH SCHOOL, MANTA ROAD",431203
CHURU,SONI NURSING HOME,PURANA FALSA,331023
UDUPI,SONIA CLINIC & NURSING HOME,"24, ANANTHA NAGAR, MANIPAL",576104
DELHI,SONIA HOSPITAL,"1, GULSHAN PARK, N.H - 10, MAIN ROHTAK ROAD, NANGLOI",110041
CHENNAI,SOORIYA HOSPITAL,"# 1, ARUNACHALAM ROAD, SALIGRAMAM, OPP.A.V.M STUDIO",600093
BANGALORE,SOUKYA HOSPITAL,"NO 17, NIT LAYOUT, VIDYARANYAPURA MAIN ROAD",560097
HYDERABAD,SOUMYA MULTI SPECIALITY HOSPITAL,"BEHIND SATYAM COMPUTERS, KARKHANA,",500009
CHENNAI,SOUNDARAPANDIAN BONE AND JOINT HOSPITAL,"#AA16, 3RD MAIN ROAD, NEAR ANNA NAGAR ROUNDABOOT",600040
DELHI,SOUTH POINT HOSPITAL,"G-48,49 MASJID MOTH GREATER KAILASH 2",110048
KOLKATA,SOUTH SUBURBAN CLINIC PVT LTD,"# 67, DIAMOND HARBOUR ROAD,5TH  FLOOR",700038
GUNTUR,SOWJANYA NURSING HOME,"# 1-163, MACHERLA ROAD, KARAMPUDI.",522614
KARAMADAI,SOWMIYA  HOSPITAL,"K.N.P. ROAD,KARAMADAI, OPP TO OM SAKTHI TEMPLE.",641104
HYDERABAD,SOWMYA HOSPITAL,"1-9-49/B/1, RAMNAGAR, HYDERABAD",500020
TRIVANDRUM,SP FORT HOSPITAL,FORT TRIVANDRUM ,695023
MIDNAPUR,SPANDAN DIAGNOSTIC CENTRE,"RABINDRANAGAR,P.O.MIDNAPORE, MEDNIPUR PASCHIM",721101
NAGPUR,SPANDAN HEART INSTITUTE AND RESEARCH CENTRE,"5,ABHAYANKAR ROAD, DHANTOLI,",440012
DHULE,SPANDAN HOSPITAL,"W.B.ROAD,NEHRU NAGAR DEOPUR",424002
THANE,SPANDAN HOSPITAL,"D.P. ROAD, KATRAP, BADLAPUR EAST,",421503
AHMEDABAD,SPANDAN MEDICAL & RESEARCH CENTRE,"TULIP BUNGALOW ROAD, OPP SUDERSHAN TOWER, SUN & STEP CLUB THALTEJ,",380054
NORTH24PARAGANAS,"SPANDAN, MEDICARE","# 16 NS ROAD, KODALLIABATTALA, NORTH 24 PARAGANAS",700146
KARKALA,SPANDANA MATERNITY & GENERAL HOSPITAL,"MANGALORE ROAD, KARKALA,",574104
BANGALORE,SPANDANA NURSING HOME,"# 546/46, 6TH MAIN, 4TH BLOCK,RAJAJINAGAR.",560010
BANGALORE,"SPARSH HOSPITAL FOR ACCIDENTS, ORTHOPAEDICS & PLASTIC SURGERY & MAXILLO FACIAL","NO – 29/P2, NARAYANA HRUDAYALAYA CAMPUS, NEAR B.T.C COLLEGE STOP",560099
KHURDA,SPARSH HOSPITALS & CRITICAL CARE PVT LTD,"A-407,SAHEEDNAGAR, KHURDA, BEHIND METRO HOUSE, VANI VIHARBHUBANESHWAR",751007
GHAZIABAD,SPARSH MEDICARE & TRAUMA CENTRE,"PLOT # 54, SHAKTIKHAND-III, INDIRAPURAM",201010
NAGPUR,SPARSH UROLOGY KIDNEY HOSPITAL,"# 35, NEW BALRAJ MARG, DHANTOLI,NEAR SUBHIKSHA",440012
BANGALORE,SPATICA SUPER SPECIALITY HOSPITAL,"RING ROAD, HSR  LAYOUT, SECTOR 6,",560034
COCHIN,SPECIALIST HOSPITAL,ERNAKULAM NORTH,682018
MUMBAI,SPECIALITY EAR NOSE THROAT HOSPITAL,"SATYAM TOWER, 90FT RD,THAKUR COMPLEX, .BEHIND HDFC BANK, NEAR SAI DHAM OPP WESTERN EXPRESS HIGHWAY, KANDIVALI EAST",400101
MUMBAI,SPECTRUM EYE CARE,"NO.103,1ST FLOOR,VIKAS COMMERCIAL CENTRE, C.G ROAD, CHEMBUR",400074
KOLKATA,SPEED AGE HOSPITAL,"848, LAKE TOWN, JASSORE ROAD, BLOCK A",700089
SALEM,SPMM HEALTH CARE SERVICES PVT LTD,"# 29, CUDDALORE MAIN ROAD, AMMAPET. NEAR SRINIVASA THEATRE",636003
CHENNAI,SPOT HOSPITAL,"#36, DR.AMBERKAR ROAD, KODAMBAKKAM",600024
DELHI,SPRING DALES MEDICAL CENTRE,"D-4, PRASHANT VIHAR OUTER RING ROAD), ROHINI, NEW DELHI",110085
BANGALORE,SPRING LEAF HEALTH CARE PVT LTD,"#60/3, KONAPPANA AGRAHARA, OPP.INFOSYS CONVENTION CENTRE",560100
COIMBATORE,SPT HOSPITALS,"50, VIVEKANANDA ROAD, RAM NAGAR, OPP.MEENA EYE HOSPITAL",641009
BANGALORE,SPURTHY HOSPITAL,"# 22, 1ST MAIN CHOCOLATE FACTORY ROAD, TAVAREKERE BTM 1ST STAGE.",560029
GUNTUR,SRAVANI HOSPITAL,"OLD BANK ROAD, KOTHAPET,NEAR ANNA SRINIVSARAO KALYANAMANDAPAM",522001
COIMBATORE,SREE ABHIRAMI HOSPITALS P) LIMITED,"33, MADUKKARAI ROAD, SUNDARAPURAM,",641024
COIMBATORE,SREE ABHISHEK HOSPITAL,"#1, RAJU GARDENS,",641025
COIMBATORE,SREE ABIRAMI HOSPITALS (P) LTD,"33, MADUKARAI ROAD,SUNDARAPURAM.",641024
COIMBATORE,SREE ANDAL HOSPITAL,"39 BHARTHI NAGAR, VILAN KURACHI POST",641035
EASTGODAVARI,SREE BALA  NURSING HOME & SREE BALA ENT CARE CENTER,"12-2-24, DANTUVARI STREET EAST GODAVARI, LANE BEHIND CHANDANA BROTHERS",533001
TRIVANDRUM,SREE GOKULAM MEDICAL COLLEGE & RESEARCH FOUNDATION,"KARINJATHI ROAD,VENJARAMOODU",695607
KADAPA,SREE HOSPITAL,"2/402,RS ROAD,KADAPA",516001
MAVELIKARA,SREE KANTAPURAM HOSPITAL,KANDIYOOR Mavelikara,690103
BANGALORE,SREE LAKSHMI HOSPITAL,"21ST CROSS,KAGGADASAPURA MAIN ROAD,C.V.RAMAN NAGAR POST,",560093
COIMBATORE,SREE LAVANYA HOSPITAL,"5, KONGU NAGAR,MARUTHAMALAI ROAD, BHARATHIYAR UNIVERSITY POST, KALVEERAMPALAYAM",641046
SECUNDERABAD,SREE MARUTHI NURSING HOME,"PLOT NO-18, INDRAPURI RIALWAY COLONY,",500026
THENI,SREE MOHAN HOSPITAL,"702, MADURAI ROAD, OPP TO UTI BANK",625531
CHENNAI,SREE NARAYANA NURSING HOME,"# 7, BHARATHI ROAD, PERAMBUR.",600011
GUNTUR,SREE RADHA KRISHNA NURSING HOME,"9-3-18, OLD BUS STAND, SATTENAPALLI.",522403
MADHUGIRI,SREE RAGHAVANDRA NURSING HOME,"BIDANU ROAD, NEAR TOLEGATE, MADHUGIRI",572132
COIMBATORE,SREE RAMM NURSING HOME,"4/277,MAIN ROAD, NGGO COLONY",641022
BANGALORE,SREE RANGA HOSPITAL,"1/7,1ST FLOOR,NAGADEVANAHALLI,KENGERI POST,",560060
CHENGALPATTU,SREE RENGA HOSPITAL,"12, VARADA REDDY STREET,VEDACHALA NAGAR,",603001
chennai,SREE SAI KRISHNA POLYCLINIC HOSPITAL,"# 32/1 OLD 63/1, KILPAUK GARDEN ROAD,TUK NAGAR",600010
THENI,SREE SAIRAM HOSPITAL,60 FEET SCHEME ROAD KOTTAIKALAM,625531
