MUMBAI,NEELAM NURSING HOME,"LAXMI PALACE, S.V. ROAD WEST, OPP SUNDER NAGAR",400064
HYDERABAD,NEELIMA HOSPITAL,"PANDURANGA NAGAR, PANDURANGA NAGAR BUS STOP",500018
GURGAON,NEELKANTH HOSPITALS PRIVATE LIMITED,1NATHUPUR ROAD N.R.-1)QUTUB ENCLAVE PHASE -3DLF,122022
INDORE,NEEMA HOSPITAL PVT LTD,"715-16, VIJAY SYNDICATE, ANNAPURNA ROAD.",452009
DELHI,NEERA EYE CENTRE & LASER VISION,"91-B, SHYAMLAL ROAD, DARYAGANJ .",110002
LUCKNOW,NEERA HOSPITAL,Mahanagar Extn,226006
BANGALORE,NEHA PRAKASH HOSPITAL,"NO - 8, 6th MAIN ROAD, YNT ",560106
GUWAHATI,NEMCARE HOSPITAL,"G.S. ROAD,",781005
AHMEDABAD,NEO CHILDREN HOSPITAL,"M/5, BLOCK-1, SHASTRINAGAR, ANKUR ROAD, OPP SHASTRI NAGAR BUS STAND",380063
HYDERABAD,NEO VISION EYE CARE & LASER CENTRE,"7-102/7,SAI ENCLAVE, HABSIGUDA",500007
BANGALORE,NEPHRO LIFE CARE,"NO-2,SETLUR STREET HOCKEY STADIUM LANEFORD ROAD",560027
KURNOOL,NERAVATI HOSPITAL,"HNO 1-184A,GANDHI CHOWK,NANDYAL",518508
BELGAUM,NERLI HOSPITAL,"ASHOK NAGAR,NIPANI",591237
MUMBAI,NEST ACCIDENT & FRACTURE HOSPITAL,"OFF GOKHALE ROAD,NAUPADA,THANE WEST",400602
KOLKATA,NETAJI NURSING HOME & DIAGNOSTIC CENTRE,"4D, EKBALPORE LANE,",700023
MANGALORE,NETAJI-A.YELLAPPA MEMORIAL HOSPITAL,"NH-17,THOKKOTTU",575020
BANGALORE,NETHRADHAMA HOSPITAL PVT LTD,"256/14, KANAKAPURA MAIN ROAD,7TH BLOCK JAYANAGAR.",560082
BANGALORE,NETHRAKASHI EYE HOSPITAL & MICRO SURGICAL CENTRE,"# 122, 2ND MAIN ROAD,9TH CROSS,CHAMARAJPET",560018
AHMEDABAD,NETR - THE EYE CARE CLINIC,"VISION HOUSE, OPP.KAMESHWAR SCHOOL, NR.JODHPUR CROSS ROAD, SATELLITED",380015
BANGALORE,NETRA ENTERPRISES PRABHA EYE CLINIC & RESEARCH CENTRE,"NO.504,40TH CROSS,8TH BLOCK,JAYANAGAR,",560070
MUMBAI,NETRA JYOT EYE CARE CENTRE,"NO.206,JAY COMMERCIAL COMPLEX,S.L.ROAD,MULUND WEST",400080
AMRAVATI,NETRA JYOT EYE HOSPITAL,TEJUL TOWER NEAR RAJAPETH POLICE STATION,444601
MYSORE,NETRA JYOTHI EYE HOSPITAL,"# 1475,ABOVE HOTEL VENKATESH BNAVAN MISSION HOSPITAL ROAD,",570001
AHMEDABAD,NETRA RAKSHA HOSPITAL,"INDIA COLONY, APPROACH BUS STAND",382350
RAJKOT,"NETRADEEP EYE HOSPITAL P) LTD,","STATE TRANSPORT BUS STATION, BEHIND KANAK ROAD",360001
HOWRAH,NETRAJYOTI EYE CARE CENTRE,"116/1, G.T. ROAD, BALLY, OPP BALLY HOUSE,",711201
MUMBAI,NETRAJYOTI EYE CARE CENTRE,"#205, second floor, kesar kripa Co.Op housing Soc., Chandavarkar Road,aobve Saraswat Bank, Diagonally opp Raj Mahal Hotel, Borivali West, ",400092
AHMEDABAD,NETRAM CARE EYE HOSPITAL,"APM MALL,OPPSUN-NSTEP CLUP,SATADHAR,SOLA ROAD",380061
DELHI,NETRAYATAN HOSPITAL,"Dr.Grover's Centre for Eye Care, S-371, Greater Kailash - II, ",110048
BARODA,NEUROSURGICAL HOSPITAL,"1ST FLOOR, SANSTHA VASAHAT, RAOPURA",390001
MYSORE,NEW ADARSHA HOSPITAL,"CONTOUR ROAD, 3RD STAGE",570002
AGRA,NEW AGRA HOSPITAL,"NEAR AGAR, DAYAR BAGRA",282005
CHENNAI,NEW ASIAN HOSPITAL,"E-147/4, 2ND AVENUE, BESANT NAGAR",600090
KURNOOL,NEW BALAJI SUPER SPECIALITY HOSPITAL,"43/19-20,N.R.PETA",518001
BHOPAL,NEW BHOPAL HOSPITAL & RESEARCH FOUNDATION,"172, ZONE 2, NR. SARGAM TALKIES, MAHARANAPRATAP NAGAR",462011
BAREILLY,NEW BORN CHILD & CRITICAL CARE CENTRE,"35-Z-1, RAMPUR GARDEN.",243001
HOWRAH,NEW EDEN NURSING HOME,"BAZARPARA, PAN ARATH",711316
THANE,NEW HEALTHCARE NURSING HOME,"SATELITE PARK, NEAR G.C.C. HATKESH, MIRA ROAD,THANE. ",401107
CHENNAI,NEW HOPE MEDICAL CENTRE,"# 814, POONAMALLEE HIGH ROAD",600010
KOLAR,NEW KAMADHENU NURSING HOME,"OPPOSITE SHARADHA TALKIES, NEAR KSRTC BUS STAND, ",563101
KOLAR,NEW KOLAR NURSING HOME,"2nd CROSS, KUVEMPUNAGAR, NEAR BUS STAND (KSRTC)",563101
KANPUR,NEW LEELAMANI HOSPITAL,"14/116-C-1, CIVIL LINES",208001
HYDERABAD,NEW LIFE HOSPITAL,"16-6-104 TO-109, CHADERGHAT,HYDERABAD-",500024
INDORE,NEW LIFE HOSPTIAL,"162/1, SANWER ROAD, NEAR BANGANGA, THANA",452001
AHMEDABAD,NEW LIFE MEDICAL & HEART HOSPITAL,"203,PRAMUKH PALACE, MANINAGAR, NEAR JAYHIND CHAR RASTA.",380008
KOLKATA,NEW LIFE NURSING HOME," SAHA BAGAN, RAJARHAT ROAD",700059
KANDIVALI,NEW LIFE NURSING HOME,"11-12/A, THAKUR COMPLEX, TIRUPATI TOWER, OPPOSITE MAHINDRA COMP, WESTERN EXPRESS HIGHWAY",400101
DELHI,NEW MEDICAL CENTRE,"B-39, MOTI NAGAR, NEAR ACHARYA BIKSHU HOSPITAL",110015
KOLKATA,NEW NIRNOY NURSING HOME,"2A, KALACHAND SANYAL LANE ",700004
KURNOOL,NEW NOBLE SUPER SPECIALITY HOSPITAL,N.R.PET OP APOLLO HOSPITAL,518003
KOLKATA,NEW TOWN NURSING HOME AND DIAGNOSTIC CO P LTD,"RAJARHAT ROAD, JYANGRA, TALTALA, BAGUIATI, OPPOSITE OF SWASTI N HOME",700059
KOLKATA,NEW UNION NURSING HOME PVT LTD,"NO.6,ROBINSON STREET,SHAKESPEARE SARANI P.S,",700017
MADURAI,NEW VIKRAM HOSPITAL,"9&10, WEST MAIN ROAD, ANNANAGAR, NEAR ARAVIND EYE HOSPITAL ",625020
AHMEDABAD,NEWAGE MEDICARE,"18,MANIPUSHP,SURDHARA CIRCLE, THALTEJ",380054
SECUNDERABAD,NEWCITI HOSPITAL,Secunderabad,500003
UDUPI,NEWCITY MULTISPECIALITY HOSPITAL,"OPP SHANIESHWARA TEMPLE,VIDYARANYA MARG,KADUBETTU",576101
RANGAREDDY,NICE INSTITUTE FOR THE NEWBORN,"#10-2-247 & 248, SHANTI NAGAR, OFF.MASAB TANK, LANE OPP.TO MAHAVEER HOSPITAL",500028
CHENNAI,NICHANI HEALTH CENTRE,"#7, ARTHON ROAD,ROYAPURAM",600013
AHMEDABAD,NIDHI  HOSPTIAL,"""SHREEKUNJ""STADIUM COMMERCE COLLEGE ROAD NEAR VIPUL DUDHIYA",380009
AHMEDABAD,NIDHI EYE HOSPITAL,"54, SHRADDHADIP COMPLEX, NARNPURA, ANKUR RANNAPARK ROAD.",380013
NADIAD,NIDHI HOSPITAL,"1st FLOOR, NEAR CHETAK PETROL PUMP",387001
HYDERABAD,NIGHTANGALE HOSPITAL,"17-1-383/N.S/384, SANTHOSH NAGAR, SAIDABA",500054
KOLKATA,NIGHTINGALE DIAGNOSTIC & MEDICARE CENTRE PRIVATE LIMITED,"#11, SHAKESPEARE SARANI,",700071
DELHI,NIJHARA HOSPITAL P) LTD,"#2979/3, RANJIT NAGAR, NEAR SHIV MANDIR ",110008
PANVEL,NIKAM PARMAR HOSPITAL,"GUL APARTMENT, NEW URAN ROAD",410206
HYDERABAD,NIKHIL SUPER SP HOSPITAL,"Dilkushnagar, NEXT TO NALANDA COLLEGE, HYD",500020
VIZAG,NIKITHA HOSPITAL,"54-13-6,SEETHAMMADHARA",530013
PATTAMBI,NILA HOSPITAL PVT LTD,"PALLIPURAM ROAD,",679303
BARAMATI,NIMBALKAR HOSPITAL,"PATAS ROAD, OPP.GOVERNMENT HOSPITAL",413102
TRIVANDRUM,NIMS HOSPITAL,"NICE GARDENS,ARALAMOODU, NEYATTINKARA.",695123
BHOPAL,NIRAMAY HEART HOSPITAL,"E-2/13, ARERA COLONY, BHOPAL-462096",462001
PUNE,NIRAMAY HOSPITAL,"NARAYAN GHAR, JUNNOOR",410504
MUMBAI,NIRAMAYA HOSPITAL,"B-28/1, MAITRI PARK, SION TROMBAY ROAD, CHEMBUR,",400071
BARAMATI,NIRAMAYA MEDICAL FOUNDATION & RESEARCH CENTRE PVT LTD,"ASHOK NAGAR, BHIGWAN ROAD,NEAR PANCHAYAT SAMITHI",413102
PUNE,NIRANJAN NURSING HOME,"FLAT 71,  SECTOR 24, NEAR POLICE CHOWKI, PRADHIKARAN, NIGDI",411044
ALWAR,NIRMAL HOSPITAL,"A-170,BHAGAT SINGH COLONY OPP MODERN SCHOOL",301019
JHANSI,NIRMAL HOSPITAL,"Kanpur Road,JHANSI",284128
MUMBAI,NIRMAL NURSING HOME,"GOKUL, 93, RANADE ROAD, SHIVAJI PARK",400028
BARODA,NIRMAL SURGICAL HOSPITAL,"SECOND FLOOR, HERAMB HOUSE, NEAR GOVT PRESS KOTHI, ANANDPURA",390001
SHIMOGA,NIRMALA HOSPITAL,"SHATHAVERI GOPALGOWDA MARG,",577201
HYDERABAD,NIRMALA MATERNITY AND ORTHOPAEDIC HOSPITAL,"2/3 RT OPP POST OFFICE, VIJAYA NAGAR",500057
SIRA,NIRMALA MATERNITY HOME,"GANDHI NAGAR, SIRA",572137
KARUR,NIRMALA NURSING HOME,"9-D/12,EAST RAMAKRISHNAPURAM",639001
CHENNAI,NIRMALS EYE CARE CENTRE,"108/5, AYYASAMY STREET, WEST TAMBARAM.",600045
ICHALKARANJI,NIRMAY HOSPITAL," NIRAMAY HOSPITALMR S A PATIL691/1, WEST BOHRA MARKET, NIRAMAY RING ROAD,ICHALKARANJI",416115
MUMBAI,NIRON HOSPITAL AND RESEARCH CENTRE,"KADAMWADI, OFF.ST ANTHONY, ST.SANTACRUZ(EAST), NEAR VISHWAKARMA SAMITI  HALL",400098
AHMEDNAGAR,NISAR HOSPITAL & MATERNITY HOME,"63(1) GANESH CHOWK, CIVIL HUDCO, SAVEDI ROAD, CENTRAL ADMINISTRATIVE BUILDING ",414003
ANAND,NISHANT EYE HOSPITAL RETINA CARE LASER CENTRE,"OPP OLD DSP OFFICE, DR COOK ROAD,",388001
BEED,NITYASEVA HOSPTIAL,"PRASHANT NAGAR, AMABAJAGAI",413517
COIMBATORE,NIVRITHI HOSPITAL,"# 87, PIONEER NAGAR, JOTHIPURAM",641047
HUBLI,NMR CURIE CENTRE OF ONCOLOGY,"T.B. ROAD NEAR REVANKAR KALYAN MANTAP, DESPANDE NAGAR,BEHIND KAMAT TOURS AND TRAVELS",580029
INDORE,NOBLE HOSPITAL,"28/1, SOUTH TUKOGANJ, INDORE ",452001
PUNE,NOBLE HOSPITAL,"#153, MAGARPATTACITY ROAD,HADAPSAR",411013
AHMEDNAGAR,NOBLE HOSPITAL & RESEARCH CENTRE,"NAGAR - MANMAD ROAD, NEAR PREMDAN HOTEL",414001
NOIDA,NOIDA MEDICARE CENTRE LIMITED,"16C, SECTOR 30,BLOCK E",201303
NOIDA,NOIDA ORTHOPAEDIC CENTRE,"B-2,SECTOR-26,GAUTHAM BUDH NAGAR",201301
VIJAYAWADA,NORI MOTHER & CHILD HOSPITAL,"N.R.R ROAD,GANDHINAGAR",520003
KOLKATA,NORTH CITY HOSPITAL & NEURO INSTITUTE PVT.LTD,"#73, BAGMARI RD, KOLKATA",700054
BANGALORE,NORTH STAR MATERNITY & NURSING HOME,"#4, SARAKKI INDUSTRIAL ESTATE,3RD PHASE,J.P.NAGAR,BANNERGHATTA ROAD.",560076
DELHI,NORTHEX STONE CLINIC,"A-7, FIRST FL GUJARANWALA TOWN 1, G.T. KARNAL ROAD, .",110009
DELHI,NORTHPOINT HOSPITAL,"S-357, PANCHASHILA PARK",110017
BANGALORE,NORTHSIDE HOSPITAL & DIAGNOSTIC CENTRE,"NO 8, G BLOCK, 60FT ROAD, SAHAKAR GANAGAR",560092
HYDERABAD,NOVA ENT HOSPITAL,"H. NO-6-3-652, IST FLOOR, KAUTILYA BLOCK, SOMAJIGUDA, HYD",500482
LUCKNOW,NOVA HOSPITAL LTD,"NH-2, VIKAS KHAND-1, GOMTHI NAGAR",226010
BANGALORE,NOVAMED CENTERS (INDIA) PVT LTD,"143, 1st CROSS, 5th BLOCK, KORAMANGALA, BARISTA, WILLIAM PENN, JYOTI NIVAS COLLEGE",560034
GUNTUR,NRI GENERAL HOSPITAL,"CHINAKAKANI, MANGALAGIRI MANDAL.",522503
BANGALORE,NRR HOSPITAL,"#3 & 3A, HESARAGATTA MAIN ROAD, CHIKKASANDRA, NEAR CHIKKABANAVARA RLY STATION",560090
BANGALORE,NU HOSPITALS PRIVATE LIMITED,"C.A. 6, 15TH MAIN, 11TH CROSS,",560070
MUMBAI,NU-LIFE HOSPITAL,"A1, HAREKRISHNA BUILDING, 1ST FLOOR, NEAR TELEPHONE EXCHANGE, L.B.S.MARG, GHATKOPAR W)",400086
DELHI,NULIFE HOSPITAL & MATERNITY CENTRE,"1616, OUTRAM LINES, KINGSWAMY CAMP, G-T-B NAGAR, DELHI",110009
MUMBAI,NULIFE HOSPITAL PVT LTD,"B-101 TO 110, ANIRAJ TOWER CHS LTD, OPP.METRO MALL, L.B.S ROAD, BHANDUP(W)",400078
THANE,NULIFE MATERNITY HOSPITAL AND ICU,"# 2,3, BALKRISHNA CHS,OPP TILAKNAGAR PO, DOMBIVLI EAST,",421201
JAMSHEDPUR,NU-LIFE NURSING HOME,"S-TYRE CHOWK, ADITYAPUR, SARALKELA KHARSAWA, SINGHBHUM E)",831013
SURAT,NUPOOR GENERAL HOSPITAL,"MAKAI POOL, NAMPURA, OPP.DOTIWALA BAKERY",395001
DELHI,NU-TECH MEDIWORLD,"487, HARDEV PURI, NEAR FATHER ANGEL SCHOOL, GAUTAM NAGAR,",110049
AHMEDABAD,OCULUS EYE HOSPITAL,"OCULUS, JAYDEEP TOWER NEAR SHREYAS CROSSING, PALDI.",380007
MUMBAI,OCULUS EYE HOSPITAL PVT LTD,"12/223, JUHU SHEETAL, GULMOHAR CROSS ROAD, # 9, JVPD, SCHEME",400058
AMRITSAR,OHRI HOSPITAL,"G.T. ROAD,PUTLIGHAR",143001
NAGPUR,OKE EYE HOSPITAL,"98,BAJAJ NAGAR",440010
RAJKOT,OM BABY CARE HOSPITAL,"11,KASHI VISHWANATH PLOT,NEAR DHARAM CIMNEMA,OPP JAYHIND PRESS",360001
MUMBAI,OM CHILDREN MATERNITY & SURGICAL NURISNG HOME,"ROAD #22,KISAN NAGAR 3,WAGLE ESTATE,THANE",400006
HAZARIBAGH,OM HEALTH CARE,"C/O DR. SHARAD JAIN, THANA CHOWK, RAMGARH CANTT,",829122
FARIDABAD,OM HOSPITAL,"58KM STONE,DELHI-MATHURA ROAD, PALWAL,                               ",121102
MUMBAI,OM HOSPITAL,"AZAD ROAD, PARNAKA, OPP.SHAMI MANDIR",401201
NASHIK,OM HOSPITAL,"NASIK ROAD, GAIKWAD MALA,REGI MENTAL PLAZA, ",422101
PUNE,OM HOSPITAL,"SURVEY NO.201/5,HUTATMA CHOWK,ALANDI ROAD,BHOSARI,",411039
PUNE,OM HOSPITAL,VETALBABA CHOWK,411016
PUNE,OM HOSPITAL & MATERNITY HOME,"BEHIND PDCC BANK,SHIKRAPUR",412208
FIROZABAD,OM HOSPITAL & RESEARCH CENTRE,"S.M. ROAD, ",283203
MUMBAI,OM HOSPITAL AND POLYCLINIC & ICU,"IST FLOOR, COMMERCE CENTRE, TANDON ROAD, DOMIBIVILI E)",421201
THANE,OM HOSPITAL CARDIAC MEDICAL CENTRE,"BLDG B.9,POONAM NAGAR, PHASE III, SHANTI PARK, SECTOR 7, MIRA ROAD EAST,",401101
SINDHUDURGA,OM KARTAVYA SADHANA HOSPITAL,"ABHINAV NAGAR KUDAL, DIST- SINDHU DURG, VENGURLA KUDAL ROAD,",416520
RANBENNUR,OM MULTISPECIALITY HOSPITAL,"OPP, KARNATAKA SANGHA STATION ROAD",581115
BARGARH,OM NURSING HOME,"AT/PO, ATTABIRA",768027
PUNE,OM SHREE SWAMI SAMARTH HOSPITAL,"OPP CHAITANYA SABHAGRUHA,60 PAWANA NAGAR,CHINDHWAD",411033
NAGPUR,OM SURGICAL HOSPITAL AND TRAUMA CENTRE,"WEST HIGH COURT ROAD,  NEAR BANK OF BARODA GOKULPETH  ",440010
MANGALORE,OMEGA HOSPITAL PVT LTD,"KANKANADY,NEAR MAHAVEER CIRCLE (PUMPWELL,CIRCLE)",575002
PUNE,OMKAR ACCIDENT HOSPITAL,"PUNE-NASIK HIGHWAY, TALEGAON CHAWK,                        CHAKAN",411501
MUMBAI,OMKAR EYE CARE CENTRE,"#302,303, KOTESHWAR PLAZA, IN OF RHB ROAD, J NEHRU ROAD, MULUND WEST",400080
MUMBAI,OMKAR HOSPITAL,"1STFLOOR,BHOOMI GARDEN,MAHAVIR NAGAR, KANDIVLIW)",400067
PUNE,OMKAR HOSPITAL,"PANGALLI, GUNWADI ROAD, NEAR MHADA COLONY, ",413102
PUNE,OMKAR MATERNITY AND SURGICAL NURSING HOME,"BEHIND, ST STAND, CENTER ROAD, REVENUE COLONY, NAVIPETH, TAL SHIRUR ",412210
CHANDIGARH,OMNI HOSPITAL,"SCO 343-344-345, SECTOR 34-A, ",160022
BIDAR,OMNICARE HEALTH SERVICES PVT LTD  APEX HOSPITAL ),"GANESH MAIDAN,",585401
SHIMOGA,ONKAR HOSPITAL,1 ST PARALLEL ROAD DURGIGUDI,577201
NAGPUR,ORANGE CITY HOSPITAL & RESEARCH INSTITUTE,"19, PANDE LAYOUT, KHAMLA ROAD - RING ROAD JUNCTION, VEER SAVARKAR SQUARE,",440015
MUMBAI,ORBIT EYE CLINIC,"110, MARKAZ VIEW, S.V. ROAD, OPP.24-KARAT MULTIPLEX",400102
MUMBAI,ORBIT SUPERSPECIALITY HOSPITAL,"WESTERN EXPRESS HIGHWAY,NEAR DAHISAR NAKA,MIRA ROAD,THANE",401104
DELHI,ORCHID HOSPITAL & HEART CENTRE,"C-3/91, JANAK PURI,",110058
MALAPURAM,ORCHID INSTITUTE OF HEALTH CARE & RESEARCH (P) LTD,"DOWN HILL,",676519
KOLKATA,ORCHID NURSING HOME,"P-17,C.I.T.ROAD,SCHEME VIM)NEAR PHOOLBAGAN CROSSING,",700054
MAYURBHANJ,ORISSA NURSING HOME AND RESEARCH CENTRE,"W.NO.13, STATION BAZAR OCTRAI GATE,P.O. BARIPADA",757001
NAGPUR,ORTHO RELIEF HOSPITAL AND RESEARCH CENTRE,"PLOT NO 19,OPP RAMKRISHNA MISSION, DHANTOLI,NAGPUR",440012
MUMBAI,ORTHOCARE & RIA NURSING HOME,"204, PATILS HERITAGE, SAROJANI NAIDU ROAD, TAMBE NAGAR, MULUNDW)",400080
THANE,ORTHOCARE HOSPITAL,"1STFLOOR GAUTAM CHANBERS, NEAR PUNJANI INDUSTRIAL ESTATE",400602
MUMBAI,ORTHOMAX SUPERSPECIALITY HOSPITAL,"101/C, AMBIKA PLAZA, 90 FEET ROAD, MULAND E)",400081
DELHI,ORTHONOVA HOSPITAL,"C-5/29. S.D.A. OPP. IIT MAIN GATE, NEW DELHI",110016
THANE,ORTHONOVA HOSPITAL,"201-205, SOHAM PLAZA, SOHAM GARDENS, G.B. ROAD, OPP. MANPADA PETROL PUMP, THANE WEST.",400607
DELHI,ORTHOPLUS HOSPITAL,"RZ-B-28, Gopal Nagar, Najaf garh",110043
BANGARPET,OSWAL HOSPITAL,"CORNATION ROAD, BANGARPET.",563114
BANGALORE,OXFORD HOSPITAL,"# 1364, 1ST STAGE, SARAKKI GATE, KANAKAPURA ROAD, JP NAGAR, ",560078
PUNE,OYSTER AND PEARL HOSPITAL PVT LTD,"# 1671-75,GANESHKIND ROAD SHIVAJINAGAR, BEHIND HOTEL PRIDE EXECUTIVE",411005
CHENNAI,P&G NURSING HOME,"NEW#42, OLD#60, JAWAHARLAL NEHRU 100FT ROAD,VADAPALANI",600026
BANGALORE,P.D.HINDUJA SINDHI HOSPITAL,"12TH A CROSS,SINDHI HOSPITAL ROAD,SAMPANGIRAMNAGAR.",560027
KUPPAM,P.E.S.INSTITUTE OF MEDICAL SCIENCES AND RESEARCH,"KUPPAM, CHITTOR ",517425
HOLENARSIPURA,P.G.HOSPITAL,"NEAR GOVT BUS STAND, HOLE NARSIPURE",573211
ERODE,P.G.HOSPITAL,"452/286, HOSPITAL ROAD,PULIAMPATTI, NEAR AATHI PARASAKTHI TEMPLE",638459
MALAPURAM,P.G.MEDICAL TRUST HOSPITAL,"NILAMBUR, MALAPPRAM DIST",676505
POLLACHI,P.K.D NURSING HOME,"#77,MGM STREET, NEAR TO MAHATMA GANDHI MANDAPAM AND TOWN POLICE STATION",642001
ERODE,P.K.HOSPITAL,"2,ERODE-SATHY ROAD,KRISHNAPURAM,KAVINDAPADI,BHAVANI",638455
SALEM,P.K.S.HOSPITAL,"40, AMMAPET MAIN ROAD.",600021
MAVELIKARA,P.M.HOSPITAL,"NADAKAVU,MAVELIKARA,",690101
AHMEDABAD,P.N.DESAI EYE HOSPITAL,"4, L.K SOCIETY, BEHIND SUNSET, RAW HOUSE, GURUKUL ROAD, MEMNAGAR",380052
KANYAKUMARI,P.P.K.HOSPITAL,"3/34-D, MAIN ROAD, MARTHANDAM",629165
SALEM,P.R.N.CRITICAL CARE CENTRE AND HOSPITALS,"82/B--2, PERAMANUR MAIN ROAD",636007
TRIVANDRUM,P.R.S.HOSPITAL,"TC. NO. 21/44, KILLIPALAM,",695002
KANYAKUMARI,P.S.MEDICAL TRUST HOSPITAL,"PUTHUVILAI, THALAKULAM VILLAGE",629802
ERNAKULAM,P.S.MISSION HOSPITAL,MARADU LINK ROAD.KOCHI,682304
CHITRADURG,P.V.S.HOSPITAL,"6TH CROSS,J.C.R. EXTENSION, CHITRADURGA",577501
COCHIN,P.V.S.MEMORIAL HOSPITAL LTD.,"NEAR KALOOR BUS STAND, ",682017
PALAKKAD,PAALANA INSTITUTE OF MEDICAL SCIENCES,"KANNADI,",678701
COIMBATORE,PAAVAI HOSPITAL,"NEW NO - 3, CHINNAMAL STREET, K.K PUDAR, NEAR BOMBAY DYING SHOW ROOM ",641038
AHMEDNAGAR,PADGHAU HOSPTIAL,"NIVASA ROAD, SHREERAMPUR,",413709
BHADRAK,PADHI HEALTHCARE & RESEARCH CENTRE,"NEAR BY-PASS,KACHERI ROAD,NAYABAZAR",756100
KURNOOL,PADMA CHANDRA KIDNEY CENTRE SUPER SPECIALITY HOSPITAL,"NALANDA COMPLEX, BESIDE HOTEL RAJ VIHAR.",518001
CHENNAI,PADMA CLINIC & NURSING HOME,"753, POONAMALLEE HIGH ROAD, KILPAUK, OPP. PACHAIYAPPA COLLEGE, NEAR TO AARTHI SCAN ",600010
BANGALORE,PADMA DEVAIAH HOSPITAL & RESEARCH CENTRE,"19/1,19TH CROSS,BHUVANESHWARI NAGAR",560023
BHUBANESWAR,PADMA HOSPITAL,"210/1320, SARALA NAGAR, LAXMISAGAR CHHACK, KHURDA",751006
RAJAPALAYAM,PADMA HOSPTIAL,"# 164, P.A.C.R. SALAI,RAJAPALAYAM",626117
BANGALORE,PADMABHUSHAN DR.M.C.MODI CHARITABLR EYE HOSPITAL,"PADMABHUSHAN DR. M.C. MODI ROAD, MAHALAKSHMIPURA.",560086
GAJUWAKA,PADMAJA HOSPITAL,OLD GAJUWAKA JUNCTION,530026
PARBHANI,PADMAJA HOSPITAL,"STATION ROAD, OPP TO Z.P. GIRLS HIGH SCHOOL",431401
CHENNAI,PADMAPRIYA HOSPITAL,"#28,FIRST AVENUE, INDRA NAGAR, ADYAR",600020
MUMBAI,PADMASHREE NURSING HOME,"A-11/3, APURVA APARTMENTS, L B S MARG, MULUND W)",400080
BANGALORE,PADMASHREE NURSING HOME & MATERNITY HOME,"1108/30 10TH MAIN 4TH CROSS, RPC LAYOUT, VIJAYANAGAR",560040
KARIMNAGAR,PADMAVATHI HOSPITAL,3-1-293 ; CHRISTAIN COLONY ; ; KARIMNAGAR,505001
BANGALORE,PADMAVATHI HOSPITAL,"#67/1,HVR COMPLEX, MAGADI ROAD.",560072
MANGALORE,PADMAVATHI HOSPITAL,"SURATKAL OPP,SURATICAL MUNICIPAL CORPORATION",575014
KRISHNA,PADMAVATHI HOSPITALS,"#10/145, RAJENDRA NAGAV(MAIN LINE)",521301
WARANGAL,PADMAVATHI MULTI SPECIALITY NURSING HOME,THORRUR DR.K. YAJAGERRI,506163
ONGOLE,PADMAVATHI NURSING HOME,"NEAR RAJDHANI HOTEL, SANTHAPETA, PRAKASAM",523001
GUNTUR,PADMAVATHY SUPER SPECIALITY HOSPITAL,"OPP:HEAD POST OFFICE,KOTHAPET",522001
MUMBAI,PADMAVATI MATERNITY & NURSING HOME,"213-211, BUILDING # 2, OSWAL ORNATE,JESAL PARK,BHAYANDER EAST, THANE.",401105
THANE,PADMINI HOSPITAL,"ABOVE SHREEDEVI HOTEL, NEAR S.B.I., MURBAD ROAD, KALYAN WEST,",421301
CHENNAI,PADMINI NURSING HOME,"# 9, 15NEW NO) PACHAIYAPPA COLLEGE HOSTEL ROAD, CHETPET",600031
SIVAGANGAI,PADMINI UROLOGY CLINIC,"NO-11, SANTHA VINAYAKAR KOIL STREET, OPPOSITE LIC, V.O.C ROAD",630001
VASCO,PAI HOSPITAL,WADI VASGODAGAM ,403802
PUNE,PAI HOSPITAL,"#15/7,BHULESHWAR SOCIETY, NEAR SANKAR MAHARAJ MATH,POONA SATARA ROAD,DHANAKAWADI",411043
AHMEDABAD,PALAK EYE CLINIC,"3RD FLOOR,B-BLOCK,SURYA RANI COMPLEX,132 FT RING ROAD,AKHBARNAGAR CIRCLE",380013
AHMEDABAD,PALAK EYE HOSPITAL,"#7, SHIVNANGAN AVENUE, OPP RADHA-VALLABH MANDIR,",380008
PALAKKAD,PALGHAT POLY CLINIC,KANNATHUR MEDU,678013
SANGLI,PALKAR EYE HOSPTIAL,"1684, GANESH NAGAR, NEAR CIVIL HOSPITAL ",416416
MUMBAI,PALKAR POLYCLINIC & HOSPITAL,"#121, GOYAL SHOPPING ARCADE OPP.STATION, BORIVLI WEST.",400092
KADAPA,PALLA KRISHNAIAH MEMORIAL NURSING HOME,"OPP. POLICE GATE, CHRIST ON LINE",516001
CHENNAI,PALLAVA HOSPITAL LTD,"19-A,FIRST AVENUE, NEAR ASHOK PILLAR",600083
VIZAG,PALLAVI HOSPITAL,"NO.15-2-8A,GOKHALE ROAD,MAHARANIPETA,",530002
AURANGABAD,PALNITKAR HOSPITAL,"PLOT NO-4, ADALAT ROAD, NEAR BABA PETROL PUMPS, BEHIND RAVIRAJ HOTEL,BHAGYANAGAR",431001
MANDSAUR,PAMNANI HOSPITAL AND RESEARCH CENTER,"PREM COLONY, RAILWAY STATION ROAD,OPP SHANTIRAJ HOSPITAL",458001
MUMBAI,PANACEA HOSPITAL,"# 141, SAI ARCADE, LINE ALFMISION COPM,PANVEL",410206
BANGALORE,PANACEA HOSPITALS PRIVATE LIMITED,"334,3RD STAGE, 4TH BLOCK, BASAVESHWARNAGAR",560079
KOLKATA,PANACEA NURSING HOME,"32B, BARASATI ROAD, PO-NOWACHANDAN PUKUR",700122
PUNE,PANCHSHEEL HOSPITAL,"# 368, NANA PETH, NEAR BY-SAINT KABIR POLICE CHOWKY.",411002
DELHI,PANCHSHEEL HOSPITAL PRIVATE LIMITED,"C-3/64 A,YAMUNA VIHAR",110053
AHMEDABAD,PANCHSHIL HOSPITAL,"HIGHWAY, RAMNAGAR,SABARMATI",380005
CUTTACK,PANDA MEDICAL CENTRE,"KESHARPUR,BEPARI SAHI,BUXI BAZAR.",753001
CUTTACK,PANDA MEDICAL CENTRE,"TELENGAPENTH,N.H-5,",753091
JAJAPUR,PANDA NURSING HOME,"MAHAVEER CHOWK ROAD,JAJPUR TOWN",755001
BHUBANESWAR,PANDA NURSING HOME PVT LTD,"A/115,PRESS COLONY, UNIT 3",753001
RAIPUR,PANDEY NURSING HOME,195 SAPTA COLONY,492001
MADURAI,PANDIAN ADVANCED MEDICAL CENTRE(PAMC),"36/1, SIVAGANGAI ROAD, K.K.NAGAR, NEAR AAVIN MILK DIARY",625020
MUMBAI,PANDYA SURGICAL & MATERNITY HOSPITAL,"RAMA NIWAS, SODAWALA LANE, OPP DR SS PANDYA CHOWK, BORIVLI WEST",400092
GHAZIABAD,PANNALAL SHYAMLAL HOSPITAL,"II-F/172, AMBEDKAR ROAD,NEAR KALKA GARHI CHOWK.",201001
YAVATMAL,PAPALKAR HOSPITAL,"NEAR T.V. CENTRE, TALAO LAYOUT,PUSAD, YEOTMAL",445204
THANE,PARAKRUTI HOSPITAL,"SIDDESHWAR ORCHID,OLD MUMBAI-PUNE ROAD, OPP MANISHA NAGAR, GATE # 1,KALA, THANE WEST",400605
GHAZIABAD,PARAM JYOTI HOSPITAL,"# 481, FRIENDS SOCIETY SECTOR- 12, VASUNDHARA",201012
HYDERABAD,PARAMITHA CHILDRENS HOSPITAL,"3-8, CHAITANYAPURI 'X' ROAD, DILKUSHNAGAR",500060
MUMBAI,PARAMOUNT GENERAL HOSPITAL,"SAKI NAKA JUNCTION, ANDHERI EAST",400072
KOLKATA,PARAMOUNT HEALTH CARE,"148&151, G.T.ROAD, MANIKTALA, SERAMPORE",712201
SILIGURI,PARAMOUNT HOSPITAL PVT.LTD.,"MANGAL PANDEY ROAD, SILIGURI",734405
RAIGAD,PARAMOUNT MEDICAL SERVICES PVT.LTD,"PLOT NO-225/B, PARAMOUNT HOUSE, NEAR MTNL OFFICE",410206
DELHI,PARAMTEJ SEHRA MEDICAL & RESEARCH CENTRE,"29-NORTH WEST AVENUE,CLUB ROAD,PANJABI BAGH, ",110026
PUNE,PARANJPE EYE CLINIC & SURGERY CENTRE,"894, VENKATESH APT, FCRO, DECCAN GYMKHANA,",411044
GURGAON,PARAS HOSPITAL,C-1 SUSHANT LOK-1 NEAR SHALOM SCHOOL.,122002
GHAZIABAD,PARAS HOSPITAL,"SEC IV/130, VAISHALI",201010
DELHI,PARAS SPRING MEADOWS HOSPITAL ,"F-44, EAST OF KAILASH,",110065
BAVLA,PARAS SURGICAL HOSPTIAL,"DESAI COMPLEX ,NEAR KRISHNA CINEMA, STATION ROAD",382220
AMRAVATI,PARASHREE HOSPITAL & PARASHREE ACCIDENT HOSPITAL,"KHAPARDE BAGICHA, MASJID IRWIN ROAD",444602
AGRA,PAREEK HOSPITALS P) LTD.,"4/10, BAGH FARZANA, CIVIL LINES, AGRA",282002
MUMBAI,PAREKH EYE & CHILD CLINIC,"301, MADHAV APARTMENT, JAWAHAR ROAD, OPP.RAILWAY STATION, GHATKOPAR(E)",400077
MUMBAI,PAREKH EYE HOSPITAL,"15-A,DIAMOND PALACE,HILL ROAD BANDRA WESST",400050
AHMEDABAD,PAREKHS HOSPITAL,"SHYAMAL CROSS ROADS,SATELLITE",380051
KOTTAYAM,PARET MAR IVANIOS HOSPITAL,PUKHUPPALY,686011
NASHIK,PARIJAT HOSPITAL,"1348, PACHORE LANE, NEAR S.T. STAND, ON NASIK-PUNE HIGHWAY, SINNAR",422103
NASHIK,PARIJAT HOSPITAL & DIAGNOSTIC CENTRE,"BEHIND CIDCO OFFICE,",422009
NALGONDA,PARIJATHA HOSPITAL,"# 20-21/5-DOCTORS COLONY, MIRYALAGUDA",508207
AHMEDABAD,PARIMAL HOSPITAL,"NEAR OVER BRIDGE, PUNIT MARG, ",380008
KOLKATA,PARK CLINIC (PARK MEDICAL RESEARCH SOCIETY),"#4 GORKY TERRACE, GORKY SADAN",700017
HYDERABAD,PARK HEALTHCARE,"6-3-903/A & B SOMAJIGUDA, NEAR YASHODA HOSPITAL",500082
DELHI,PARK HOSPITAL,"12, CHOWKHANDI NEAR KESHO, PUR DEPOT W), OUTER RING ROAD",110018
GURGAON,PARK HOSPITAL,"1805-PALAM GURGAON ROAD,NEAR UDYOG VIHAR",122022
COIMBATORE,PARK HOSPITAL,"KALAPATTI ROAD,NEAR SITRA,CIVIL AERODROMEPOST),",641014
RATNAGIRI,PARKAR HOSPITAL AND RESEARCH INSTITUTE PVT LTD,"828, SHIVAJINAGAR,NEAR MARUTI MANDIR",415612
MUMBAI,PARLE EYE HOSPITAL,"#12,DHARAM PREM APT,ABOVE SHIV SAGAR RESTAURANT SHRADDHANAND ROAD,VILE PARLE EAST",400057
MUMBAI,PARMAR HOSPITAL,"63/C, AMITA APARTMENT, 5TH KASTRUBA ROAD, BORAVILI EAST",400066
ROPAR,PARMAR NURSING HOME,"BELA ROAD,ROPAR",140001
KUNDLI,PARNAMI ORTHOPAEDIC HOSPITAL,A-15 PANCHAWATI AZADPUR,110033
KUNDLI,PARNAMI ORTHOPAEDIC HOSPITAL,"32 MILES STONE. NEAR NIDHU CINEMA, G.T.KARNAL ROAD,",131028
AHMEDABAD,PARTH EYE HOSPITAL,"MANGAL PARK BUS STOP,GITA MANDIR ROAD,",380022
AHMEDABAD,PARTH HOSPITAL,"OPP.OMKAR DAIRY, NEAR RAMJI MANDIR, RAMNAGAR",380005
SURAT,PARTH HOSPITAL,"SAMAY COMPLEX, ANAND MAHAL ROAD, ADAJAN.",395009
AHMEDABAD,PARTH MATERNITY & MEDICAL NURSING HOME,"SHREE KRISHNA TOWER, NR. PRIYA CINEMA KRISHNANAGAR, ON NATIONAL HIGH WAY ROAD",382346
AHMEDABAD,PARTH SURGICAL HOSPITAL,"2ND FLOOR SHASHI SHOPPING CENTRE, NEAR ANJALI CROSS ROADS,VASNA ROAD",380007
COIMBATORE,PARTHIBAN NURSING HOME,"NO.11-H,SUBRAMANIAM PALAYAM ROAD,G.N.MILLS,",641029
BHOPAL,PARUL HOSPITALS PVT LTD,"HIG - 2, NEAR 6,1/2 NO.BUS STOP",462016
MUMBAI,PARULEKAR HOSPITAL,"PLOT 8/3A, SECTOR-6, AIROLI",400708
SECUNDERABAD,PARVATHI NURSING HOME,"E-30/31, VIKRAMPURI COLONY,",500003
MEERUT,PARVATI DEVI POLYCLINIC NURSING HOME & CANCER RESEARCH CENTRE,"WESTERN KACHARY ROAD, CHHIPI TANK, MEERUT-250001.NEAR N.A.S. DEGREE COLLEGE & EVES CHAURAHA",250001
BELGAUM,PARVATI EYE CARE CENTRE,"PUJARI BUILDING, K.C ROAD",591201
MUMBAI,PARVISH NURSING HOME,"12 SHIRAZ, TELLI GALLI, ANDHERI E)",400069
SATARA,PATANGE HOSPITAL,"538, ISG, GANAPATHY, WAI",412803
CHITRADURG,PATANJALI HOSPITAL PVT LTD,"OPP.STATE BANK OF MYSORE,DHARMASHALA ROAD,",577501
BARODA,PATANJALY HOSPITAL,"PUSHTHI COMPLEX, HARIOM NAGAR BUS STOP, NR. ATMAJYOTI ASHRAM, ELLORA PARK,",380023
MUMBAI,PATARIA NURSING HOME,"2, NAUNATH CHS, PLOT # 1,  M.G. CROSS ROAD, # 4, KANDIVALI WEST",400067
AHMEDABAD,PATEL E.N.T HOSPITAL,"103, ASHVARATH CENTRE, USMANPURA CHAR RASTA,",380013
DELHI,PATEL HOSPITAL,"U-158, VATS COMPLEX, SHAKARPURMAIN VIKAS MARG",110092
BHUJ,PATEL HOSPITAL,"NEW STATION ROAD, BHUJ",370001
MUMBAI,PATEL NURSING HOME,"B. VISHAL APARTMENTS SIR M.V. ROAD, ANDHERI EAST,",400089
NASHIK,PATIL ACCIDENT HOSPITAL,"OPP S.T. STAND,SINNAR",422103
PUNE,PATIL EYE HOSPITAL,"GANDHI BUILDING,1ST FLOOR,PUNE NASHIK ROAD",411039
BANGALORE,PATIL HOSPITAL,"#42-B1, BELOW SYNICATE  BANK,SRI THIMMAPPA COMPLEX,OLD MADRAS ROAD,KRISHNARAJAPURAM.",560036
AHMEDNAGAR,PATIL HOSPITAL,KOTHI CHOWK STATION ROAD,414001
KARAD,PATIL HOSPITAL,"BUDHWAR PETH,  NEAR KRISHNA – NAKA, ",415110
SATARA,PATIL HOSPITAL PVT.LTD.,"LAXMI NAGAR, KOREGAON,",415501
DANDELI,PATIL NURSING HOME,"A.J.N ROAD,DANDELI,UTTAR KANNADA",581325
KOPPAL,PATIL NURSING HOME,"GANDHINAGAR, GANGAVATHI",583227
DHANBAD,PATLIPUTRA NURSING HOME,"JORA PHATAK ROAD, OPP GURUDWARA",826001
PATNA,PATNA BONE & SPINE HOSPITAL,"H-3, DOCTOR'S COLONY, RAGENDRA NAGAR OVER BRIDGE.",800020
AURANGABAD,PATNE HOSPITAL & MATERNITY HOME,"PLOT#25, HOTEL AURANGABAD ASHOK PREMISES, NEAR MANMANDIR TRAVELS.",431001
MUMBAI,PATORIA EYE HOSPITAL,"PLOT NO.301,MAHAVIR NIWAS ON APNA BAZAR,CIRCLE OPP.SEAWOODS RAILWAY STATION,SECTOR-21,NERUL,",400706
DELHI,PAUL NURSING HOME & SANJIVANI DIAGNOSTIC CENTRE,"235, AVTAR ENCLAVE, PASCHIMVIHAR ",110063
KOLAR,PAVAN NURSING HOME,"J C ROAD, SRINIVAS PURAM",563135
JAGTIAL ,PAVANI EYE HOSPITAL,ASLOK NAGAR,683101
CHENNAI,PAVITHRA HOSPITAL,"NO.7,ETHRIRAJ SWAMY SALAI,ERUKKENCHERY,",600118
RAIGAD,PAWAL CLINIC,"PLOT # 32, SECTOR-9, OPP D.A.V. SCHOOL, NEW PANVEL EAST",410206
